{
  "eventId": "33333333-3333-4333-8333-333333333333",
  "eventType": "OrderConfirmed",
  "eventVersion": 1,
  "occurredAt": "2026-01-01T12:01:00Z",
  "tenantId": "tenant-demo",
  "country": "PE",
  "order": {
    "tenantId": "tenant-demo",
    "country": "PE",
    "customerId": "CUSTOMER-001",
    "orderId": "22222222-2222-4222-8222-222222222222",
    "orderNumber": "ORD-22222222-2222-4222-8222-222222222222",
    "quoteId": "11111111-1111-4111-8111-111111111111",
    "currency": "PEN",
    "total": {
      "amount": "1363",
      "currency": "PEN",
      "scale": 2
    },
    "status": "CONFIRMED",
    "createdAt": "2026-01-01T12:01:00Z"
  }
}
